{
  "schema_version": "3.0",
  "run_id": "CAM-008-C",
  "blind_condition_label": "COND-Z2",
  "panel_count": 6,
  "image_layout": "individual_panels",
  "active_axis_order": [
    "torso_orientation_to_camera",
    "face_presentation",
    "shoulder_presentation",
    "hip_presentation",
    "back_visibility",
    "orientation_assessability",
    "full_body_visibility",
    "ambiguity_or_artifact"
  ],
  "summary": {
    "overall_visible_pattern": [
      "Opaque condition COND-Z2: torso orientation counts={\"three_quarter\":3,\"rear\":3}.",
      "Opaque condition COND-Z2: orientation assessable=6/6.",
      "Opaque condition COND-Z2: ambiguity/artifact=1/6."
    ],
    "analysis_notes": [
      "Observer input exposed only opaque condition IDs, opaque panel IDs, and visible pixels; prompts, seeds, requested orientation, run mapping, PromptTag IDs, and emitted phrases were withheld.",
      "The 18-panel opaque observation record was frozen before mapping disclosure at SHA-256 c451f3878f8ed14a235d9c938726bc6b666df8c88108fc9d8611da28d3bb6ec8.",
      "Canonical run_id and seed binding was applied only after decode and did not change any frozen visual row.",
      "Requested-orientation alignment, matched-seed comparison, threshold application, and final classification are review-derived only in research-review.md."
    ]
  },
  "panels": [
    {
      "panel_id": 1,
      "axis_values": [
        "three_quarter",
        "rear_or_hidden",
        "oblique",
        "oblique",
        "visible",
        "assessable",
        "visible",
        "orientation_ambiguous"
      ],
      "primary_morphology": "camera_orientation_observation",
      "secondary_morphologies": [],
      "evidence_notes": [
        "Most of the back is visible from an elevated, slightly off-center rear viewpoint.",
        "The face is hidden by the rearward head position and hair.",
        "The full body is present, though the rear versus three-quarter boundary is shallow."
      ],
      "cross_domain_effects": [],
      "artifacts": [
        "orientation_ambiguous"
      ],
      "confidence": "medium",
      "contact_load": {
        "left_hand": "unclear",
        "right_hand": "unclear",
        "left_forearm": "unclear",
        "right_forearm": "unclear"
      }
    },
    {
      "panel_id": 2,
      "axis_values": [
        "rear",
        "rear_or_hidden",
        "rear",
        "rear",
        "visible",
        "assessable",
        "visible",
        "none"
      ],
      "primary_morphology": "camera_orientation_observation",
      "secondary_morphologies": [],
      "evidence_notes": [
        "The shoulder blades, shirt back, and shorts rear face the camera symmetrically.",
        "No facial features are visible; only the back of the head and neck are shown.",
        "The standing figure is fully visible from head to heels."
      ],
      "cross_domain_effects": [],
      "artifacts": [
        "none"
      ],
      "confidence": "high",
      "contact_load": {
        "left_hand": "unclear",
        "right_hand": "unclear",
        "left_forearm": "unclear",
        "right_forearm": "unclear"
      }
    },
    {
      "panel_id": 3,
      "axis_values": [
        "three_quarter",
        "profile",
        "oblique",
        "oblique",
        "visible",
        "assessable",
        "visible",
        "none"
      ],
      "primary_morphology": "camera_orientation_observation",
      "secondary_morphologies": [],
      "evidence_notes": [
        "The back is broad in view while one side of the torso and pelvis recedes.",
        "The head turn exposes a single facial side in profile.",
        "The full figure and both feet are visible."
      ],
      "cross_domain_effects": [],
      "artifacts": [
        "none"
      ],
      "confidence": "high",
      "contact_load": {
        "left_hand": "unclear",
        "right_hand": "unclear",
        "left_forearm": "unclear",
        "right_forearm": "unclear"
      }
    },
    {
      "panel_id": 4,
      "axis_values": [
        "three_quarter",
        "rear_or_hidden",
        "oblique",
        "oblique",
        "visible",
        "assessable",
        "visible",
        "none"
      ],
      "primary_morphology": "camera_orientation_observation",
      "secondary_morphologies": [],
      "evidence_notes": [
        "The shirt back and shorts rear are visible with a clear diagonal across shoulders and hips.",
        "The face is not visible beyond a small side edge beneath the hair.",
        "The figure is uncropped from head through feet."
      ],
      "cross_domain_effects": [],
      "artifacts": [
        "none"
      ],
      "confidence": "high",
      "contact_load": {
        "left_hand": "unclear",
        "right_hand": "unclear",
        "left_forearm": "unclear",
        "right_forearm": "unclear"
      }
    },
    {
      "panel_id": 5,
      "axis_values": [
        "rear",
        "rear_or_hidden",
        "rear",
        "rear",
        "visible",
        "assessable",
        "visible",
        "none"
      ],
      "primary_morphology": "camera_orientation_observation",
      "secondary_morphologies": [],
      "evidence_notes": [
        "The centered back, shoulders, and shorts rear are symmetrically presented.",
        "Hair covers the rear of the head and no face is visible.",
        "The entire figure is visible with both heels in frame."
      ],
      "cross_domain_effects": [],
      "artifacts": [
        "none"
      ],
      "confidence": "high",
      "contact_load": {
        "left_hand": "unclear",
        "right_hand": "unclear",
        "left_forearm": "unclear",
        "right_forearm": "unclear"
      }
    },
    {
      "panel_id": 6,
      "axis_values": [
        "rear",
        "rear_or_hidden",
        "rear",
        "rear",
        "visible",
        "assessable",
        "visible",
        "none"
      ],
      "primary_morphology": "camera_orientation_observation",
      "secondary_morphologies": [],
      "evidence_notes": [
        "The back of the top, both rear pockets, and both shoulder backs face the camera.",
        "The face is fully hidden by the rearward head and hair.",
        "The full standing body and feet are shown."
      ],
      "cross_domain_effects": [],
      "artifacts": [
        "none"
      ],
      "confidence": "high",
      "contact_load": {
        "left_hand": "unclear",
        "right_hand": "unclear",
        "left_forearm": "unclear",
        "right_forearm": "unclear"
      }
    }
  ],
  "leakage": [],
  "uncertain": [],
  "ontology_extension_candidates": [],
  "cross_condition_comparison": {
    "status": "not_performed",
    "reason": "This file preserves condition-local prompt-blind visible evidence; mapping decode and matched comparison occur only in research-review.md after freeze.",
    "observations": []
  },
  "computed_aggregate": {
    "axis_counts": {
      "torso_orientation_to_camera": {
        "three_quarter": 3,
        "rear": 3
      },
      "face_presentation": {
        "rear_or_hidden": 5,
        "profile": 1
      },
      "shoulder_presentation": {
        "oblique": 3,
        "rear": 3
      },
      "hip_presentation": {
        "oblique": 3,
        "rear": 3
      },
      "back_visibility": {
        "visible": 6
      },
      "orientation_assessability": {
        "assessable": 6
      },
      "full_body_visibility": {
        "visible": 6
      },
      "ambiguity_or_artifact": {
        "orientation_ambiguous": 1,
        "none": 5
      }
    },
    "primary_morphology_counts": {
      "camera_orientation_observation": 6
    },
    "secondary_morphology_counts": {},
    "artifact_counts": {
      "orientation_ambiguous": 1,
      "none": 5
    },
    "cross_domain_effect_counts": {},
    "leakage_counts": {}
  }
}
