{
  "schema_version": "3.0",
  "run_id": "CAM-027-A",
  "blind_condition_label": "COND-01",
  "panel_count": 6,
  "image_layout": "individual_panels",
  "active_axis_order": [
    "observed_framing",
    "upper_crop_boundary",
    "lower_crop_boundary",
    "head_visibility",
    "torso_visibility",
    "pelvis_visibility",
    "knees_visibility",
    "feet_visibility",
    "face_detail",
    "framing_boundary_assessable",
    "ambiguity_or_artifact"
  ],
  "summary": {
    "overall_visible_pattern": [
      "Opaque condition COND-01: observed requested upper_body framing=1/6.",
      "Opaque condition COND-01: framing boundary assessable=6/6.",
      "Opaque condition COND-01: ambiguity/artifact=0/6."
    ],
    "analysis_notes": [
      "Observer input exposed only opaque condition IDs, opaque panel IDs, image hashes, and visible pixels; prompts, seeds, requested framing, run mapping, PromptTag IDs, and emitted terms were withheld.",
      "The 24-panel opaque observation record was frozen before mapping disclosure at SHA-256 3d87d38184dcdf5a2e82961583ddb9b74a3267c329d6d61c271c33fef4d7ac48.",
      "Canonical run_id and seed binding was applied only after decode and did not change any frozen visual row.",
      "Requested-framing alignment, matched-seed comparison, CAM-024 comparison, and final classification are review-derived only in research-review.md."
    ]
  },
  "panels": [
    {
      "panel_id": 1,
      "axis_values": [
        "close_up",
        "above_head",
        "chest",
        "visible",
        "partial",
        "not_visible",
        "not_visible",
        "not_visible",
        "high",
        "assessable",
        "none"
      ],
      "primary_morphology": "camera_framing_observation",
      "secondary_morphologies": [],
      "evidence_notes": [
        "Face and upper torso dominate; lower edge crosses the chest."
      ],
      "cross_domain_effects": [],
      "artifacts": [
        "none"
      ],
      "confidence": "high",
      "contact_load": {
        "left_hand": "unclear",
        "right_hand": "unclear",
        "left_forearm": "unclear",
        "right_forearm": "unclear"
      }
    },
    {
      "panel_id": 2,
      "axis_values": [
        "upper_body",
        "above_head",
        "waist",
        "visible",
        "visible",
        "partial",
        "not_visible",
        "not_visible",
        "high",
        "assessable",
        "none"
      ],
      "primary_morphology": "camera_framing_observation",
      "secondary_morphologies": [],
      "evidence_notes": [
        "Head and torso are contained; lower edge reaches the waist."
      ],
      "cross_domain_effects": [],
      "artifacts": [
        "none"
      ],
      "confidence": "high",
      "contact_load": {
        "left_hand": "unclear",
        "right_hand": "unclear",
        "left_forearm": "unclear",
        "right_forearm": "unclear"
      }
    },
    {
      "panel_id": 3,
      "axis_values": [
        "close_up",
        "above_head",
        "upper_chest",
        "visible",
        "partial",
        "not_visible",
        "not_visible",
        "not_visible",
        "high",
        "assessable",
        "none"
      ],
      "primary_morphology": "camera_framing_observation",
      "secondary_morphologies": [],
      "evidence_notes": [
        "Face and shoulders dominate; lower edge crosses the upper chest."
      ],
      "cross_domain_effects": [],
      "artifacts": [
        "none"
      ],
      "confidence": "high",
      "contact_load": {
        "left_hand": "unclear",
        "right_hand": "unclear",
        "left_forearm": "unclear",
        "right_forearm": "unclear"
      }
    },
    {
      "panel_id": 4,
      "axis_values": [
        "close_up",
        "above_head",
        "chest",
        "visible",
        "partial",
        "not_visible",
        "not_visible",
        "not_visible",
        "high",
        "assessable",
        "none"
      ],
      "primary_morphology": "camera_framing_observation",
      "secondary_morphologies": [],
      "evidence_notes": [
        "Face and chest dominate; lower torso is outside the frame."
      ],
      "cross_domain_effects": [],
      "artifacts": [
        "none"
      ],
      "confidence": "high",
      "contact_load": {
        "left_hand": "unclear",
        "right_hand": "unclear",
        "left_forearm": "unclear",
        "right_forearm": "unclear"
      }
    },
    {
      "panel_id": 5,
      "axis_values": [
        "close_up",
        "above_head",
        "chest",
        "visible",
        "partial",
        "not_visible",
        "not_visible",
        "not_visible",
        "high",
        "assessable",
        "none"
      ],
      "primary_morphology": "camera_framing_observation",
      "secondary_morphologies": [],
      "evidence_notes": [
        "Face and chest dominate; lower edge crosses the chest."
      ],
      "cross_domain_effects": [],
      "artifacts": [
        "none"
      ],
      "confidence": "high",
      "contact_load": {
        "left_hand": "unclear",
        "right_hand": "unclear",
        "left_forearm": "unclear",
        "right_forearm": "unclear"
      }
    },
    {
      "panel_id": 6,
      "axis_values": [
        "close_up",
        "above_head",
        "chest",
        "visible",
        "partial",
        "not_visible",
        "not_visible",
        "not_visible",
        "high",
        "assessable",
        "none"
      ],
      "primary_morphology": "camera_framing_observation",
      "secondary_morphologies": [],
      "evidence_notes": [
        "Face and upper torso dominate; lower edge crosses the chest."
      ],
      "cross_domain_effects": [],
      "artifacts": [
        "none"
      ],
      "confidence": "high",
      "contact_load": {
        "left_hand": "unclear",
        "right_hand": "unclear",
        "left_forearm": "unclear",
        "right_forearm": "unclear"
      }
    }
  ],
  "leakage": [],
  "uncertain": [],
  "ontology_extension_candidates": [],
  "cross_condition_comparison": {
    "status": "not_performed",
    "reason": "This file preserves condition-local prompt-blind visible evidence; mapping decode and matched comparison occur only in research-review.md after freeze.",
    "observations": []
  },
  "computed_aggregate": {
    "axis_counts": {
      "observed_framing": {
        "close_up": 5,
        "upper_body": 1
      },
      "upper_crop_boundary": {
        "above_head": 6
      },
      "lower_crop_boundary": {
        "chest": 4,
        "waist": 1,
        "upper_chest": 1
      },
      "head_visibility": {
        "visible": 6
      },
      "torso_visibility": {
        "partial": 5,
        "visible": 1
      },
      "pelvis_visibility": {
        "not_visible": 5,
        "partial": 1
      },
      "knees_visibility": {
        "not_visible": 6
      },
      "feet_visibility": {
        "not_visible": 6
      },
      "face_detail": {
        "high": 6
      },
      "framing_boundary_assessable": {
        "assessable": 6
      },
      "ambiguity_or_artifact": {
        "none": 6
      }
    },
    "primary_morphology_counts": {
      "camera_framing_observation": 6
    },
    "secondary_morphology_counts": {},
    "artifact_counts": {
      "none": 6
    },
    "cross_domain_effect_counts": {},
    "leakage_counts": {}
  }
}
